{
  "$schema": "https://json-schema.org/draft/2020-12/schema",
  "title": "Toolchain",
  "description": "The marker `xplainer setup` leaves behind, and the first thing `xplainer daemon install` reads. ADR 0020 §Ordering fixes both its existence and its job: install \"checks a marker written by `setup` (`toolchain.json`, recording the Chrome Headless Shell and TTS versions, paths and checksums), verifies the recorded paths still exist, and on failure exits 3 having written nothing\" — because neither `install` nor the daemon ever downloads, so a machine whose render toolchain is absent must be told at install time rather than three days later inside a render. It lives at `<state dir>/toolchain.json`. It is a checked contract rather than a private file because three surfaces read it and none of them owns it: `setup` writes it, install's read-only preflight validates it, and `daemon update`'s compatibility check compares the workspace it records against an incoming runtime's template pins. The three components are the two binaries a render needs \u2014 the Chrome Headless Shell that draws every frame, and the speech synthesiser every narration goes through, each recorded with the route that acquired it, because the routes are not interchangeable and none of them can be inferred from what is on disk \u2014 plus the workspace payload, which is recorded here rather than beside the runtime because it survives daemon updates while the runtime does not. Every path in it is absolute and resolved on the machine it describes — a marker copied to another machine names files that are not there, which is precisely what the preflight's existence check catches.",
  "type": "object",
  "additionalProperties": false,
  "required": ["format_version", "created_at", "chrome", "speech", "workspace"],
  "properties": {
    "format_version": {
      "type": "integer",
      "minimum": 1,
      "description": "The shape of this document. A version this build does not know is a rollback signal and never corruption: the marker is preserved and the reader says which version it met, the same rule the job store applies to a record written by a newer daemon."
    },
    "created_at": {
      "type": "string",
      "format": "date-time",
      "description": "When `setup` finished acquiring what is recorded below. RFC 3339, so a support report can say how old the toolchain is without the file's mtime, which a copy or a restore rewrites."
    },
    "chrome": { "$ref": "#/$defs/ToolchainComponent" },
    "speech": { "$ref": "#/$defs/ToolchainComponent" },
    "workspace": { "$ref": "#/$defs/ToolchainWorkspace" }
  },
  "$defs": {
    "ToolchainComponent": {
      "title": "ToolchainComponent",
      "type": "object",
      "additionalProperties": false,
      "required": ["version", "path", "sha256", "provider"],
      "description": "One acquired component: what it is, where it ended up, what it hashed to, and which route brought it. Most routes acquire one file and `path` names it. A route that acquires several — the in-process ONNX speech path needs a model graph, a voice tensor and a platform runtime, and no one of them is the component — also records `files`, so that a reader checking that what `setup` produced is still here checks all of it rather than the one artefact `path` happened to name.",
      "properties": {
        "version": {
          "type": "string",
          "minLength": 1,
          "description": "The version acquired, exactly as its own provider spells it. Compared as a string and never parsed: an upgrade is reported to the user, and the daemon never applies one itself."
        },
        "path": {
          "type": "string",
          "minLength": 1,
          "description": "The absolute path this component was resolved to. `install` checks that it still exists before it registers anything, which is the difference between \"setup has been run\" and \"setup has been run and its results are still here\"."
        },
        "sha256": {
          "type": "string",
          "pattern": "^[0-9a-f]{64}$",
          "description": "The SHA-256 of the acquired artefact, lowercase hex, as verified against the expected digest the toolchain manifest carries for this platform. Recorded so a later check can tell a replaced binary from a missing one."
        },
        "provider": {
          "type": "string",
          "pattern": "^[a-z][a-z0-9-]*$",
          "description": "Which route acquired this component — `remotion` for the Chrome build the pinned Remotion line selects, and `docker`, `bundle`, `url` or `onnx` for the four speech routes. A machine-readable token rather than prose, because `status` branches on it and a remediation that named the wrong route would send a user to reinstall something they never installed."
        },
        "files": {
          "type": "array",
          "description": "Every file this component is made of, where it is made of more than the one `path` names. Optional, and absent for every route that acquires a single artefact — which is why adding it did not move `format_version`: a build that does not read it still finds everything it needs, and a build that does reads a strictly larger set. It is a **small, named** set and never a tree inventory: the four artefacts the ONNX speech route pins, not the several thousand files inside an unpacked bundle. Its purpose is the existence check ADR 0020 §Ordering requires of `daemon install` — \"verifies the recorded paths still exist\" — which for a multi-file component is only meaningful if every path is recorded. The digests make the same check able to tell a replaced file from a missing one, and are what a warm cache is re-verified against instead of being trusted. It carries no `minItems`, deliberately: a provider that records the field and then leaves it empty is caught by a runtime assertion beside the provider that knows how many files its own route has, and a schema keyword would instead have made the shape depend on `provider` — a conditional, which is the one construct the codegen splitter handles badly.",
          "items": { "$ref": "#/$defs/ToolchainFile" }
        }
      }
    },
    "ToolchainFile": {
      "title": "ToolchainFile",
      "type": "object",
      "additionalProperties": false,
      "required": ["path", "sha256", "bytes"],
      "description": "One file a multi-file component is made of, and the two facts that let a later run decide whether it is still the file that was acquired.",
      "properties": {
        "path": {
          "type": "string",
          "minLength": 1,
          "description": "The absolute path on this machine, resolved the same way and for the same reason as the component's own `path`."
        },
        "sha256": {
          "type": "string",
          "pattern": "^[0-9a-f]{64}$",
          "description": "The SHA-256 of this file, lowercase hex. For a file fetched whole it is the reviewed digest it was admitted on; for a file taken out of a verified archive it is the digest of what came out, recorded so a later run can detect drift in a file whose archive is long gone."
        },
        "bytes": {
          "type": "integer",
          "minimum": 0,
          "description": "Its length. Recorded so a check can refuse a truncated or replaced file on a `stat` rather than by hashing a hundred megabytes, and so a report can say how much of the disk the component is."
        }
      }
    },
    "ToolchainWorkspace": {
      "title": "ToolchainWorkspace",
      "type": "object",
      "additionalProperties": false,
      "required": ["platform", "version"],
      "description": "The workspace payload's own identity: which platform it was resolved for, and which template it resolved.",
      "properties": {
        "platform": {
          "type": "string",
          "pattern": "^[a-z0-9]+-[a-z0-9]+$",
          "description": "`<platform>-<arch>` as the payload's manifest records it — `darwin-arm64`, `linux-x64`, `win32-x64`. A workspace holds compiled dependencies, so a payload resolved for another platform is a different artefact even when every declared version matches."
        },
        "version": {
          "type": "string",
          "minLength": 1,
          "description": "The version of the workspace template this payload resolved. It is the template package's own version and not a pin, so a reader comparing pins reads the payload's manifest; this field says which template the pins came from."
        }
      }
    }
  }
}
